{
  "pack_schema": "1.0",
  "id": "travel-hotel-booking-demo-0.1.0",
  "domain": "travel-hotel-booking",
  "version": "0.1.0",
  "key_name": "demo",
  "provider_id": "ontology:lane2:travel-hotel-booking-demo",
  "trust_tier": "Tier1",
  "nbf": "2026-03-30T00:00:00Z",
  "exp": "2030-03-31T00:00:00Z",
  "rev_epoch": 1,
  "deny_wins": true,
  "precedence": [],
  "files": {
    "context": "context.jsonld",
    "shapes": "shapes.ttl",
    "taxonomy_constraints": "taxonomy-constraints.json",
    "thesaurus": "thesaurus.jsonld",
    "vocab": "vocab.skos.jsonld"
  },
  "dc": {
    "creator": "Ontology Toolkit",
    "description": "Generated by ontology-tool build",
    "identifier": "ontology:travel-hotel-booking:v0.1.0",
    "issued": "2026-03-30",
    "rights": "Internal",
    "title": "travel-hotel-booking ontology pack"
  }
}