{
  "pack_schema": "1.0",
  "id": "economic-measurement-drift-demo-0.1.0",
  "domain": "economic-measurement-drift",
  "version": "0.1.0",
  "provider_id": "ontology:pact-public:economic",
  "trust_tier": "Tier1",
  "nbf": "2026-04-06T00:00:00Z",
  "exp": "2031-04-06T00:00:00Z",
  "rev_epoch": 1,
  "deny_wins": true,
  "precedence": [],
  "files": {
    "context": "context.jsonld",
    "vocab": "vocab.skos.jsonld",
    "shapes": "shapes.ttl",
    "thesaurus": "thesaurus.jsonld",
    "thesaurus_local": "thesaurus-local.json",
    "patterns": "patterns.json",
    "intent_mappings": "intent-mappings.json",
    "convergence": "convergence.json",
    "decision_space": "decision-space.json",
    "source_extract": "source-extract/sources.json",
    "crosswalk": "source-extract/crosswalk/economic-measurement-drift-crosswalk.v1.json",
    "ontology_sna2008": "ontology/gdp-sna2008.skos.ttl",
    "ontology_sna2025": "ontology/gdp-sna2025.skos.ttl",
    "ontology_ppp_icp2011": "ontology/ppp-icp2011.skos.ttl",
    "ontology_ppp_icp2017": "ontology/ppp-icp2017.skos.ttl",
    "ontology_measurement_drift": "ontology/measurement-drift.skos.ttl",
    "rubric_definition_consistency": "rubrics/definition-consistency/rubric.yaml",
    "rubric_basket_composition_drift": "rubrics/basket-composition-drift/rubric.yaml",
    "stability_target_gdp_definition": "stability/targets/gdp-definition-stability.yaml",
    "stability_target_ppp_methodology": "stability/targets/ppp-methodology-stability.yaml",
    "execution_checklist": "source-extract/tasks/immutable-execution-checklist.v1.json",
    "gliner_dirty_manifest": "source-extract/candidates/gliner-dirty-pass-2026-04-06/manifest.json",
    "gliner_dirty_candidates": "source-extract/candidates/gliner-dirty-pass-2026-04-06/candidates.json",
    "gliner_dirty_summary": "source-extract/candidates/gliner-dirty-pass-2026-04-06/extraction-summary.json"
  },
  "dc": {
    "identifier": "ontology:economic-measurement-drift-demo:v0.1.0",
    "title": "Economic Measurement Drift Demo Pack",
    "creator": "PACT Public Working Draft",
    "issued": "2026-04-06",
    "rights": "Apache-2.0",
    "description": "Synthetic, grounded demo pack for GDP/PPP definition and methodology drift governance."
  }
}
